{
  "experiment_id": "NL-EXP-000001",
  "kind": "computational simulation (not biological evidence)",
  "research_question": "Reference: how does virtual inhibition of PVCL alter posterior-touch propagation in the lif model?",
  "species": "caenorhabditis_elegans",
  "dataset_id": "c_elegans_reference_circuit",
  "dataset_version": "1.0.0",
  "model": "lif",
  "model_version": "v1",
  "parameters": {},
  "stimulus": [
    {
      "neuron": "PLML",
      "t_start_ms": 10,
      "t_end_ms": 60,
      "amplitude": 50.0
    },
    {
      "neuron": "PLMR",
      "t_start_ms": 10,
      "t_end_ms": 60,
      "amplitude": 50.0
    }
  ],
  "manipulations_virtual_only": {
    "silence": [
      "PVCL"
    ]
  },
  "duration_ms": 200,
  "seed": 42,
  "engine_version": "0.1.0",
  "created_utc": "2026-09-18T08:19:19.894852+00:00",
  "dataset_provenance": {
    "source": "BrainerLab (curated from cited textbook circuit)",
    "publication": "Chalfie et al. 1985; Wicks & Rankin 1995 (circuit identity); file built by scripts/make_reference_circuit.py",
    "license": "MIT (BrainerLab own file; topology = cited textbook consensus, no copied bulk data)",
    "citation": "Textbook consensus: Chalfie M. et al. The neural circuit for touch sensitivity in C. elegans. J. Neurosci. 5:956-964 (1985); Wicks S.R. & Rankin C.H. J. Comp. Physiol. A (1995) (tap withdrawal circuit).",
    "completeness": "ILLUSTRATIVE SUBSET ONLY: 16 neurons of the anterior/posterior touch-withdrawal circuit; unweighted directed topology for engine demos and deterministic tests. NOT a connectome.",
    "limitations": "Subset only (16/302 neurons); edges unweighted (weight=null); 2D coordinates schematic display-only; dynamics are model choices, not measurements."
  },
  "results": {
    "normal": {
      "spikes": {
        "ALML": [],
        "ALMR": [],
        "AVM": [],
        "PLML": [
          10,
          13,
          16,
          19,
          22,
          25,
          28,
          31,
          34,
          37,
          40,
          43,
          46,
          49,
          52,
          55,
          58
        ],
        "PLMR": [
          10,
          13,
          16,
          19,
          22,
          25,
          28,
          31,
          34,
          37,
          40,
          43,
          46,
          49,
          52,
          55,
          58
        ],
        "PVM": [],
        "AVAL": [],
        "AVAR": [
          36
        ],
        "AVBL": [
          36
        ],
        "AVBR": [
          36
        ],
        "AVDL": [],
        "AVDR": [],
        "PVCL": [
          17,
          26,
          35,
          44,
          53
        ],
        "PVCR": [
          17,
          26,
          35,
          44,
          53
        ],
        "DA1": [],
        "VB1": [
          37
        ]
      },
      "summary": {
        "per_neuron": {
          "ALML": {
            "count": 0,
            "rate_hz": 0.0
          },
          "ALMR": {
            "count": 0,
            "rate_hz": 0.0
          },
          "AVM": {
            "count": 0,
            "rate_hz": 0.0
          },
          "PLML": {
            "count": 17,
            "rate_hz": 85.0
          },
          "PLMR": {
            "count": 17,
            "rate_hz": 85.0
          },
          "PVM": {
            "count": 0,
            "rate_hz": 0.0
          },
          "AVAL": {
            "count": 0,
            "rate_hz": 0.0
          },
          "AVAR": {
            "count": 1,
            "rate_hz": 5.0
          },
          "AVBL": {
            "count": 1,
            "rate_hz": 5.0
          },
          "AVBR": {
            "count": 1,
            "rate_hz": 5.0
          },
          "AVDL": {
            "count": 0,
            "rate_hz": 0.0
          },
          "AVDR": {
            "count": 0,
            "rate_hz": 0.0
          },
          "PVCL": {
            "count": 5,
            "rate_hz": 25.0
          },
          "PVCR": {
            "count": 5,
            "rate_hz": 25.0
          },
          "DA1": {
            "count": 0,
            "rate_hz": 0.0
          },
          "VB1": {
            "count": 1,
            "rate_hz": 5.0
          }
        },
        "total_spikes": 48,
        "mean_rate_hz": 15.0,
        "behavior_proxy": {
          "forward_bias": 0.8571,
          "note": "MODEL proxy from command/motor neuron spikes, not animal behaviour."
        }
      },
      "meta": {
        "model": "lif",
        "model_version": "v1",
        "duration_ms": 200,
        "seed": 42,
        "n_edges_used": 23,
        "electrical_edges_excluded": 0
      }
    },
    "modified": {
      "spikes": {
        "ALML": [],
        "ALMR": [],
        "AVM": [],
        "PLML": [
          10,
          13,
          16,
          19,
          22,
          25,
          28,
          31,
          34,
          37,
          40,
          43,
          46,
          49,
          52,
          55,
          58
        ],
        "PLMR": [
          10,
          13,
          16,
          19,
          22,
          25,
          28,
          31,
          34,
          37,
          40,
          43,
          46,
          49,
          52,
          55,
          58
        ],
        "PVM": [],
        "AVAL": [],
        "AVAR": [],
        "AVBL": [],
        "AVBR": [
          36
        ],
        "AVDL": [],
        "AVDR": [],
        "PVCL": [],
        "PVCR": [
          17,
          26,
          35,
          44,
          53
        ],
        "DA1": [],
        "VB1": []
      },
      "summary": {
        "per_neuron": {
          "ALML": {
            "count": 0,
            "rate_hz": 0.0
          },
          "ALMR": {
            "count": 0,
            "rate_hz": 0.0
          },
          "AVM": {
            "count": 0,
            "rate_hz": 0.0
          },
          "PLML": {
            "count": 17,
            "rate_hz": 85.0
          },
          "PLMR": {
            "count": 17,
            "rate_hz": 85.0
          },
          "PVM": {
            "count": 0,
            "rate_hz": 0.0
          },
          "AVAL": {
            "count": 0,
            "rate_hz": 0.0
          },
          "AVAR": {
            "count": 0,
            "rate_hz": 0.0
          },
          "AVBL": {
            "count": 0,
            "rate_hz": 0.0
          },
          "AVBR": {
            "count": 1,
            "rate_hz": 5.0
          },
          "AVDL": {
            "count": 0,
            "rate_hz": 0.0
          },
          "AVDR": {
            "count": 0,
            "rate_hz": 0.0
          },
          "PVCL": {
            "count": 0,
            "rate_hz": 0.0
          },
          "PVCR": {
            "count": 5,
            "rate_hz": 25.0
          },
          "DA1": {
            "count": 0,
            "rate_hz": 0.0
          },
          "VB1": {
            "count": 0,
            "rate_hz": 0.0
          }
        },
        "total_spikes": 40,
        "mean_rate_hz": 12.5,
        "behavior_proxy": {
          "forward_bias": 1.0,
          "note": "MODEL proxy from command/motor neuron spikes, not animal behaviour."
        }
      },
      "meta": {
        "model": "lif",
        "model_version": "v1",
        "duration_ms": 200,
        "seed": 42,
        "n_edges_used": 23,
        "electrical_edges_excluded": 0
      }
    },
    "comparison": {
      "delta_total": -8,
      "pct_total": -16.67,
      "per_neuron": [
        {
          "neuron": "PVCL",
          "normal": 5,
          "modified": 0,
          "delta": -5,
          "pct": -100.0
        },
        {
          "neuron": "VB1",
          "normal": 1,
          "modified": 0,
          "delta": -1,
          "pct": -100.0
        },
        {
          "neuron": "AVBL",
          "normal": 1,
          "modified": 0,
          "delta": -1,
          "pct": -100.0
        },
        {
          "neuron": "AVAR",
          "normal": 1,
          "modified": 0,
          "delta": -1,
          "pct": -100.0
        },
        {
          "neuron": "PVM",
          "normal": 0,
          "modified": 0,
          "delta": 0,
          "pct": null
        },
        {
          "neuron": "PVCR",
          "normal": 5,
          "modified": 5,
          "delta": 0,
          "pct": 0.0
        },
        {
          "neuron": "PLMR",
          "normal": 17,
          "modified": 17,
          "delta": 0,
          "pct": 0.0
        },
        {
          "neuron": "PLML",
          "normal": 17,
          "modified": 17,
          "delta": 0,
          "pct": 0.0
        },
        {
          "neuron": "DA1",
          "normal": 0,
          "modified": 0,
          "delta": 0,
          "pct": null
        },
        {
          "neuron": "AVM",
          "normal": 0,
          "modified": 0,
          "delta": 0,
          "pct": null
        },
        {
          "neuron": "AVDR",
          "normal": 0,
          "modified": 0,
          "delta": 0,
          "pct": null
        },
        {
          "neuron": "AVDL",
          "normal": 0,
          "modified": 0,
          "delta": 0,
          "pct": null
        },
        {
          "neuron": "AVBR",
          "normal": 1,
          "modified": 1,
          "delta": 0,
          "pct": 0.0
        },
        {
          "neuron": "AVAL",
          "normal": 0,
          "modified": 0,
          "delta": 0,
          "pct": null
        },
        {
          "neuron": "ALMR",
          "normal": 0,
          "modified": 0,
          "delta": 0,
          "pct": null
        },
        {
          "neuron": "ALML",
          "normal": 0,
          "modified": 0,
          "delta": 0,
          "pct": null
        }
      ],
      "behavior_delta": 0.1429
    }
  }
}